epci,libepci,nature_epci,nb_com
248719353,Communauté de communes des Portes de Vassivière,CC,12
248719361,Communauté de communes de Noblat,CC,12
248900334,Communauté d'agglomération du Grand Sénonais,CA,27
248900383,Communauté de communes de l'Agglomération Migennoise,CC,8
248900524,Communauté de communes de l'Aillantais en Bourgogne,CC,13
248900664,Communauté de communes de la Vanne et du Pays d'Othe,CC,22
248900748,Communauté de communes du Gâtinais en Bourgogne,CC,26
248900896,Communauté de communes Yonne Nord,CC,23
248900938,Communauté de communes du Jovinien,CC,19
249000241,Communauté de communes du Sud Territoire,CC,27
249100074,Communauté de communes du Pays de Limours (CCPL),CC,14
249100157,Communauté de communes des Deux Vallées,CC,15
249100546,Communauté de communes du Val d'Essonne (CCVE),CC,21
249100553,Communauté de communes Entre Juine et Renarde (CCEJR),CC,16
249100595,Communauté de communes Le Dourdannais en Hurepoix (CCDH),CC,11
249500109,Communauté d'agglomération de Cergy-Pontoise,CA,13
249500430,Communauté de communes Sausseron Impressionnistes,CC,15
249500455,Communauté de communes de la Vallée de l'Oise et des Trois Forêts,CC,9
249500489,Communauté de communes du Haut Val d'Oise,CC,9
249500513,Communauté de communes du Vexin-Val de Seine,CC,26
249710047,Communauté de communes de Marie-Galante,CC,3
249710062,Communauté d'agglomération du Nord Basse-Terre,CA,6
249710070,Communauté d'agglomération Grand Sud Caraïbe,CA,11
249720053,Communauté d'agglomération de l'Espace Sud de la Martinique,CA,12
249720061,Communauté d'agglomération du Centre de la Martinique,CA,4
249730037,Communauté de communes de l'Ouest Guyanais,CC,8
249730045,Communauté d'agglomération du Centre Littoral,CA,6
249730052,Communauté de communes de l'Est Guyanais,CC,4
249740077,Communauté d'agglomération CIVIS (Communauté Intercommunale des Villes Solidaires),CA,6
249740085,Communauté d'agglomération du Sud,CA,4
249740093,Communauté d'agglomération Intercommunale de la Réunion Est (CIREST),CA,6
249740101,Communauté d'agglomération Territoire de la Côte Ouest (TCO),CA,5
249740119,Communauté d'agglomération Intercommunale du Nord de la Réunion (CINOR),CA,3
992367730,Thionville Fensch Agglomération,CA,23
994579670,Communauté de communes du Lévézou,CC,19
ZZZZZZZZZ,Sans objet,ZZ,4
